// HID\VID_0955&PID_7214
[sonic853@Arch853 ~]$ sudo usbhid-dump --model=0955
002:007:000:DESCRIPTOR         1582214240.963329
 05 01 09 05 A1 01 85 01 75 01 95 08 81 01 05 01
 75 08 95 01 25 07 46 3B 01 65 14 09 39 81 42 65
 00 05 09 15 00 25 01 09 01 09 02 09 04 09 05 09
 07 09 08 09 0E 09 0F 09 0C 09 1E 09 1D 09 1C 75
 01 95 0C 81 02 95 04 81 03 05 02 09 C5 09 C4 75
 10 95 02 15 00 26 FF FF 35 00 46 FF FF 81 02 05
 01 75 10 95 04 15 00 26 FF FF 35 00 46 FF FF A1
 00 09 30 09 31 09 32 09 35 81 02 C0 05 0C 25 01
 0A 23 02 0A 24 02 0A 21 02 75 01 95 03 81 02 75
 05 95 01 81 03 05 0C 09 01 A1 01 15 00 25 01 09
 E9 09 EA 75 01 95 02 81 02 95 01 81 03 09 CD 95
 01 81 02 95 04 81 03 C0 75 08 95 0E 81 01 06 00
 FF 09 01 A1 01 15 00 26 FF 00 09 01 85 04 75 08
 95 20 91 02 09 01 85 03 75 08 95 20 81 02 C0 06
 00 FF 09 01 A1 01 15 00 26 FF 00 09 01 85 FD 75
 10 95 74 81 02 C0 06 00 FF 09 01 A1 01 15 00 26
 FF 00 09 01 85 0A 75 08 95 20 81 02 C0 06 00 FF
 09 01 A1 01 15 00 26 FF 00 09 01 85 05 75 08 95
 2C 81 02 C0 06 00 FF 09 01 A1 01 15 00 26 FF 00
 09 01 85 06 75 08 95 2C 81 02 C0 06 00 FF 09 01
 A1 01 15 00 26 FF 00 09 01 85 07 75 08 95 2C 81
 02 C0 C0